{
  "contract_version": "1.0.0",
  "target": "/abs/path/to/repo",
  "seeded_by": { "contract": "profile:topology", "contract_version": "1.0.0" },
  "scan": { "scan_version": "1.0.0", "confidence": "high" },
  "categories": {
    "security": {
      "status": "discovered",
      "dependencies": [
        {
          "id": "security:stripe-api-key",
          "name": "STRIPE_API_KEY",
          "evidence": ["internal/billing/client.go:12", "deploy/k8s/secrets.yaml:8"],
          "related_ids": ["service:stripe-api", "config:stripe-api-key"],
          "resilience": {
            "timeout": null,
            "retry": null,
            "fallback": null,
            "health_check": null,
            "on_path": ["request"]
          },
          "details": {
            "kind": "secret",
            "provider": "kubernetes",
            "scope": null,
            "granted_to": ["internal/billing/client.go"],
            "rotation_declared": null
          }
        }
      ],
      "assumptions": [
        {
          "claim": "the secret is scoped to the billing component only",
          "why_unconfirmed": "the kubernetes secret manifest does not restrict which pods may mount it"
        }
      ]
    }
  }
}
